$ /cygdrive/c/zabbix/bin/smart/smartctl -A /dev/sda
smartctl 6.5 2016-05-07 r4318 [x86_64-w64-mingw32-win7-sp1] (sf-6.5-1)
Copyright (C) 2002-16, Bruce Allen, Christian Franke, www.smartmontools.org

=== START OF READ SMART DATA SECTION ===
SMART Attributes Data Structure revision number: 1
Vendor Specific SMART Attributes with Thresholds:
ID# ATTRIBUTE_NAME          FLAG     VALUE WORST THRESH TYPE      UPDATED  WHEN_FAILED RAW_VALUE
  5 Reallocated_Sector_Ct   0x0032   100   100   000    Old_age   Always       -       1
  9 Power_On_Hours          0x0032   100   100   000    Old_age   Always       -       259
 12 Power_Cycle_Count       0x0032   100   100   000    Old_age   Always       -       50
170 Unknown_Attribute       0x0033   099   099   010    Pre-fail  Always       -       0
171 Unknown_Attribute       0x0032   100   100   010    Old_age   Always       -       0
172 Unknown_Attribute       0x0032   100   100   010    Old_age   Always       -       0
174 Unknown_Attribute       0x0032   100   100   000    Old_age   Always       -       27
183 Runtime_Bad_Block       0x0032   100   100   000    Old_age   Always       -       0
184 End-to-End_Error        0x0033   100   100   090    Pre-fail  Always       -       0
187 Reported_Uncorrect      0x0032   100   100   000    Old_age   Always       -       0
190 Airflow_Temperature_Cel 0x0032   042   052   000    Old_age   Always       -       42 (Min/Max 15/52)
192 Power-Off_Retract_Count 0x0032   100   100   000    Old_age   Always       -       27
199 UDMA_CRC_Error_Count    0x0032   100   100   000    Old_age   Always       -       0
225 Unknown_SSD_Attribute   0x0032   100   100   000    Old_age   Always       -       377119
226 Unknown_SSD_Attribute   0x0032   100   100   000    Old_age   Always       -       0
227 Unknown_SSD_Attribute   0x0032   100   100   000    Old_age   Always       -       0
228 Power-off_Retract_Count 0x0032   100   100   000    Old_age   Always       -       0
232 Available_Reservd_Space 0x0033   098   098   010    Pre-fail  Always       -       0
233 Media_Wearout_Indicator 0x0032   084   084   000    Old_age   Always       -       0
241 Total_LBAs_Written      0x0032   100   100   000    Old_age   Always       -       377119
242 Total_LBAs_Read         0x0032   100   100   000    Old_age   Always       -       172028
249 Unknown_Attribute       0x0032   100   100   000    Old_age   Always       -       1902
252 Unknown_Attribute       0x0032   100   100   000    Old_age   Always       -       15