$ /cygdrive/c/zabbix/bin/smart/smartctl -a /dev/sda
smartctl 6.5 2016-05-07 r4318 [x86_64-w64-mingw32-win7-sp1] (sf-6.5-1)
Copyright (C) 2002-16, Bruce Allen, Christian Franke, www.smartmontools.org

=== START OF INFORMATION SECTION ===
Device Model:     INTEL SSDSC2KW120H6
Serial Number:    ZZZZZZZZZZZZZZZZZZ
LU WWN Device Id: 5 5cd2e4 14cb9ef43
Firmware Version: LSBG200
User Capacity:    120-034-123-776 bytes [120 GB]
Sector Size:      512 bytes logical/physical
Rotation Rate:    Solid State Device
Form Factor:      2.5 inches
Device is:        Not in smartctl database [for details use: -P showall]
ATA Version is:   ACS-3 (minor revision not indicated)
SATA Version is:  SATA 3.2, 6.0 Gb/s (current: 6.0 Gb/s)
Local Time is:    Thu Apr 13 16:29:53 2017 ope
SMART support is: Available - device has SMART capability.
SMART support is: Enabled

=== START OF READ SMART DATA SECTION ===
SMART overall-health self-assessment test result: PASSED

General SMART Values:
Offline data collection status:  (0x00) Offline data collection activity
                                        was never started.
                                        Auto Offline Data Collection: Disabled.
Self-test execution status:      (   0) The previous self-test routine completed
                                        without error or no self-test has ever
                                        been run.
Total time to complete Offline
data collection:                (    0) seconds.
Offline data collection
capabilities:                    (0x53) SMART execute Offline immediate.
                                        Auto Offline data collection on/off support.
                                        Suspend Offline collection upon new
                                        command.
                                        No Offline surface scan supported.
                                        Self-test supported.
                                        No Conveyance Self-test supported.
                                        Selective Self-test supported.
SMART capabilities:            (0x0003) Saves SMART data before entering
                                        power-saving mode.
                                        Supports SMART auto save timer.
Error logging capability:        (0x01) Error logging supported.
                                        General Purpose Logging supported.
Short self-test routine
recommended polling time:        (   2) minutes.
Extended self-test routine
recommended polling time:        (  15) minutes.
SCT capabilities:              (0x0039) SCT Status supported.
                                        SCT Error Recovery Control supported.
                                        SCT Feature Control supported.
                                        SCT Data Table supported.

SMART Attributes Data Structure revision number: 1
Vendor Specific SMART Attributes with Thresholds:
ID# ATTRIBUTE_NAME          FLAG     VALUE WORST THRESH TYPE      UPDATED  WHEN_FAILED RAW_VALUE
  5 Reallocated_Sector_Ct   0x0032   100   100   000    Old_age   Always       -       0
  9 Power_On_Hours          0x0032   100   100   000    Old_age   Always       -       993
 12 Power_Cycle_Count       0x0032   100   100   000    Old_age   Always       -       50
170 Unknown_Attribute       0x0033   099   099   010    Pre-fail  Always       -       0
171 Unknown_Attribute       0x0032   100   100   010    Old_age   Always       -       0
172 Unknown_Attribute       0x0032   100   100   010    Old_age   Always       -       0
174 Unknown_Attribute       0x0032   100   100   000    Old_age   Always       -       27
183 Runtime_Bad_Block       0x0032   100   100   000    Old_age   Always       -       0
184 End-to-End_Error        0x0033   100   100   090    Pre-fail  Always       -       0
187 Reported_Uncorrect      0x0032   100   100   000    Old_age   Always       -       0
190 Airflow_Temperature_Cel 0x0032   042   052   000    Old_age   Always       -       42 (Min/Max 15/52)
192 Power-Off_Retract_Count 0x0032   100   100   000    Old_age   Always       -       27
199 UDMA_CRC_Error_Count    0x0032   100   100   000    Old_age   Always       -       0
225 Unknown_SSD_Attribute   0x0032   100   100   000    Old_age   Always       -       377128
226 Unknown_SSD_Attribute   0x0032   100   100   000    Old_age   Always       -       0
227 Unknown_SSD_Attribute   0x0032   100   100   000    Old_age   Always       -       0
228 Power-off_Retract_Count 0x0032   100   100   000    Old_age   Always       -       0
232 Available_Reservd_Space 0x0033   098   098   010    Pre-fail  Always       -       0
233 Media_Wearout_Indicator 0x0032   084   084   000    Old_age   Always       -       0
241 Total_LBAs_Written      0x0032   100   100   000    Old_age   Always       -       377128
242 Total_LBAs_Read         0x0032   100   100   000    Old_age   Always       -       172028
249 Unknown_Attribute       0x0032   100   100   000    Old_age   Always       -       1902
252 Unknown_Attribute       0x0032   100   100   000    Old_age   Always       -       15

SMART Error Log Version: 1
No Errors Logged

SMART Self-test log structure revision number 0
Warning: ATA Specification requires self-test log structure revision number = 1
No self-tests have been logged.  [To run self-tests, use: smartctl -t]

SMART Selective self-test log data structure revision number 1
 SPAN         MIN_LBA         MAX_LBA  CURRENT_TEST_STATUS
    1  70403103932424  70403103932424  Not_testing
    2  70403103932424  70403103932424  Not_testing
    3  70403103932424  70403103932424  Not_testing
    4  70403103932424  70403103932424  Not_testing
    5  70403103932424  70403103932424  Not_testing
Selective self-test flags (0x4008):
  After scanning selected spans, do NOT read-scan remainder of disk.
If Selective self-test is pending on power-up, resume after 0 minute delay.