smartctl 6.5 2016-05-07 r4318 [x86_64-w64-mingw32-win8.1] (sf-6.5-1)

Copyright (C) 2002-16, Bruce Allen, Christian Franke, www.smartmontools.org

=== START OF READ SMART DATA SECTION ===

SMART Attributes Data Structure revision number: 10

Vendor Specific SMART Attributes with Thresholds:

ID# ATTRIBUTE_NAME          FLAG     VALUE WORST THRESH TYPE      UPDATED  WHEN_FAILED RAW_VALUE

1 Raw_Read_Error_Rate     0x000f   112   076   006    Pre-fail  Always       -       49599092

3 Spin_Up_Time            0x0003   093   093   000    Pre-fail  Always       -       0

4 Start_Stop_Count        0x0032   095   095   020    Old_age   Always       -       5136

5 Reallocated_Sector_Ct   0x0033   100   100   036    Pre-fail  Always       -       0

7 Seek_Error_Rate         0x000f   089   060   030    Pre-fail  Always       -       925052822

9 Power_On_Hours          0x0032   067   067   000    Old_age   Always       -       29283

10 Spin_Retry_Count        0x0013   100   100   097    Pre-fail  Always       -       0

12 Power_Cycle_Count       0x0032   099   099   020    Old_age   Always       -       2000

187 Reported_Uncorrect      0x0032   100   100   000    Old_age   Always       -       0

189 High_Fly_Writes         0x003a   100   100   000    Old_age   Always       -       0

190 Airflow_Temperature_Cel 0x0022   051   039   045    Old_age   Always   In_the_past 49 (Min/Max 38/50 #141)

194 Temperature_Celsius     0x0022   049   061   000    Old_age   Always       -       49 (0 17 0 0 0)

195 Hardware_ECC_Recovered  0x001a   064   056   000    Old_age   Always       -       149181998

197 Current_Pending_Sector  0x0012   100   100   000    Old_age   Always       -       0

198 Offline_Uncorrectable   0x0010   100   100   000    Old_age   Offline      -       0

199 UDMA_CRC_Error_Count    0x003e   200   200   000    Old_age   Always       -       3

200 Multi_Zone_Error_Rate   0x0000   100   253   000    Old_age   Offline      -       0

202 Data_Address_Mark_Errs  0x0032   100   253   000    Old_age   Always       -       0