[root@ssk-csi ~]# sudo smartctl -A /dev/sda  
smartctl 6.2 2013-07-26 r3841 [x86_64-linux-3.10.0-514.6.1.el7.x86_64] (local build)
Copyright (C) 2002-13, Bruce Allen, Christian Franke, www.smartmontools.org

=== START OF READ SMART DATA SECTION ===
SMART Attributes Data Structure revision number: 1
Vendor Specific SMART Attributes with Thresholds:
ID# ATTRIBUTE_NAME          FLAG     VALUE WORST THRESH TYPE      UPDATED  WHEN_FAILED RAW_VALUE
  1 Raw_Read_Error_Rate     0x0000   100   100   000    Old_age   Offline      -       0
  5 Reallocated_Sector_Ct   0x0000   100   100   000    Old_age   Offline      -       0
  9 Power_On_Hours          0x0000   100   100   000    Old_age   Offline      -       140
 12 Power_Cycle_Count       0x0000   100   100   000    Old_age   Offline      -       515
160 Unknown_Attribute       0x0000   100   100   000    Old_age   Offline      -       0
161 Unknown_Attribute       0x0000   100   100   000    Old_age   Offline      -       96
163 Unknown_Attribute       0x0000   100   100   000    Old_age   Offline      -       59
164 Unknown_Attribute       0x0000   100   100   000    Old_age   Offline      -       13435
165 Unknown_Attribute       0x0000   100   100   000    Old_age   Offline      -       12
166 Unknown_Attribute       0x0000   100   100   000    Old_age   Offline      -       0
167 Unknown_Attribute       0x0000   100   100   000    Old_age   Offline      -       6
168 Unknown_Attribute       0x0000   100   100   000    Old_age   Offline      -       10000
169 Unknown_Attribute       0x0000   100   100   000    Old_age   Offline      -       100
175 Program_Fail_Count_Chip 0x0000   100   100   000    Old_age   Offline      -       0
176 Erase_Fail_Count_Chip   0x0000   100   100   000    Old_age   Offline      -       0
177 Wear_Leveling_Count     0x0000   100   100   050    Old_age   Offline      -       0
178 Used_Rsvd_Blk_Cnt_Chip  0x0000   100   100   000    Old_age   Offline      -       0
181 Program_Fail_Cnt_Total  0x0000   100   100   000    Old_age   Offline      -       0
182 Erase_Fail_Count_Total  0x0000   100   100   000    Old_age   Offline      -       0
192 Power-Off_Retract_Count 0x0000   100   100   000    Old_age   Offline      -       260
194 Temperature_Celsius     0x0000   100   100   000    Old_age   Offline      -       40
195 Hardware_ECC_Recovered  0x0000   100   100   000    Old_age   Offline      -       109020
196 Reallocated_Event_Count 0x0000   100   100   016    Old_age   Offline      -       0
197 Current_Pending_Sector  0x0000   100   100   000    Old_age   Offline      -       0
198 Offline_Uncorrectable   0x0000   100   100   000    Old_age   Offline      -       0
199 UDMA_CRC_Error_Count    0x0000   100   100   050    Old_age   Offline      -       0
232 Available_Reservd_Space 0x0000   100   100   000    Old_age   Offline      -       100
241 Total_LBAs_Written      0x0000   100   100   000    Old_age   Offline      -       105311
242 Total_LBAs_Read         0x0000   100   100   000    Old_age   Offline      -       168605
245 Unknown_Attribute       0x0000   100   100   000    Old_age   Offline      -       214960