smartctl 6.6 2017-11-05 r4594 [x86_64-w64-mingw32-w10-b17134] (sf-6.6-1)
Copyright (C) 2002-17, Bruce Allen, Christian Franke, www.smartmontools.org

=== START OF SMART DATA SECTION ===
SMART/Health Information (NVMe Log 0x02, NSID 0xffffffff)
Critical Warning:                   0x00
Temperature:                        40 Celsius
Available Spare:                    100%
Available Spare Threshold:          5%
Percentage Used:                    2%
Data Units Read:                    3 467 574 [1,77 TB]
Data Units Written:                 4 308 639 [2,20 TB]
Host Read Commands:                 44 295 261
Host Write Commands:                79 345 426
Controller Busy Time:               691
Power Cycles:                       319
Power On Hours:                     924
Unsafe Shutdowns:                   48
Media and Data Integrity Errors:    0
Error Information Log Entries:      0
Warning  Comp. Temperature Time:    0
Critical Comp. Temperature Time:    0
Temperature Sensor 1:               40 Celsius